<?xml version="1.0" encoding="UTF-8"?>
<ZahtevZaPriznanjeZiga xmlns="ZAHTEV_ZA_PRIZNANJE_ZIGA"
 xmlns:xsi="http://www.w3.org/2001/XMLSchema-instance"
 xsi:schemaLocation="ZAHTEV_ZA_PRIZNANJE_ZIGA file:/D:/Projects/web/XML-project/XML_WS_Trademark_backend/src/main/resources/xmls/ZahtevZaPriznjanjeZiga.xsd" id="0">
    <MetaData>
        <BrojPrijave>BrojPrijave0</BrojPrijave>
        <DatumPodnosenja>2006-05-04</DatumPodnosenja>
    </MetaData>
    <PodnosilacPrijave>
        <Ime>Ime0</Ime>
        <Adresa>
            <Ulica>Ulica0</Ulica>
            <BrojUlice>0</BrojUlice>
            <PostanskiBroj>0</PostanskiBroj>
            <MestoPrebivalista>MestoPrebivalista0</MestoPrebivalista>
            <DrzavaPrebivalista>DrzavaPrebivalista0</DrzavaPrebivalista>
        </Adresa>
        <KontaktInformacije>
            <Telefon>Telefon0</Telefon>
            <E-mail>E-mail0</E-mail>
            <Faks>Faks0</Faks>
        </KontaktInformacije>
    </PodnosilacPrijave>
    <PodnosilacPrijave>
        <Ime>Ime1</Ime>
        <Adresa>
            <Ulica>Ulica1</Ulica>
            <BrojUlice>0</BrojUlice>
            <PostanskiBroj>0</PostanskiBroj>
            <MestoPrebivalista>MestoPrebivalista1</MestoPrebivalista>
            <DrzavaPrebivalista>DrzavaPrebivalista1</DrzavaPrebivalista>
        </Adresa>
        <KontaktInformacije>
            <Telefon>Telefon1</Telefon>
            <E-mail>E-mail1</E-mail>
            <Faks>Faks1</Faks>
        </KontaktInformacije>
    </PodnosilacPrijave>
    <Punomocnik>
        <Ime>Ime2</Ime>
        <Adresa>
            <Ulica>Ulica2</Ulica>
            <BrojUlice>0</BrojUlice>
            <PostanskiBroj>0</PostanskiBroj>
            <MestoPrebivalista>MestoPrebivalista2</MestoPrebivalista>
            <DrzavaPrebivalista>DrzavaPrebivalista2</DrzavaPrebivalista>
        </Adresa>
        <KontaktInformacije>
            <Telefon>Telefon2</Telefon>
            <E-mail>E-mail2</E-mail>
            <Faks>Faks2</Faks>
        </KontaktInformacije>
    </Punomocnik>
    <ZajednickiPredstavnici>
        <Ime>Ime3</Ime>
        <Adresa>
            <Ulica>Ulica3</Ulica>
            <BrojUlice>0</BrojUlice>
            <PostanskiBroj>0</PostanskiBroj>
            <MestoPrebivalista>MestoPrebivalista3</MestoPrebivalista>
            <DrzavaPrebivalista>DrzavaPrebivalista3</DrzavaPrebivalista>
        </Adresa>
        <KontaktInformacije>
            <Telefon>Telefon3</Telefon>
            <E-mail>E-mail3</E-mail>
            <Faks>Faks3</Faks>
        </KontaktInformacije>
    </ZajednickiPredstavnici>
    <Zig>
        <TipZiga>TipZiga0</TipZiga>
        <TipZnaka>TipZnaka0</TipZnaka>
        <IzgledZnaka>ZGVmYXVsdA==</IzgledZnaka>
        <Boje>Boje0</Boje>
        <TransliteracijaZnaka>TransliteracijaZnaka0</TransliteracijaZnaka>
        <PrevodZnaka>PrevodZnaka0</PrevodZnaka>
        <OpisZnaka>OpisZnaka0</OpisZnaka>
    </Zig>
    <BrojeviKlasaRobeIliUsluga>
        <BrojKlaseRobeIliUsluge>0</BrojKlaseRobeIliUsluge>
        <BrojKlaseRobeIliUsluge>0</BrojKlaseRobeIliUsluge>
    </BrojeviKlasaRobeIliUsluga>
    <PravoPrvenstvaIOsnov>PravoPrvenstvaIOsnov0</PravoPrvenstvaIOsnov>
    <Taksa>
        <OsnovnaTaksa>0</OsnovnaTaksa>
        <TaksaZaBrojKlasa>0</TaksaZaBrojKlasa>
        <TaksaZaGrafickoResenje>0</TaksaZaGrafickoResenje>
        <Ukupno>0</Ukupno>
    </Taksa>
    <PriloziUzZahtev>
        <PrimerakZnaka>false</PrimerakZnaka>
        <SpisakRobeIUsluga>false</SpisakRobeIUsluga>
        <Punomocje>false</Punomocje>
        <PunomocjeRanijePrilozeno>false</PunomocjeRanijePrilozeno>
        <PunomocjeNaknadnoPrilozeno>false</PunomocjeNaknadnoPrilozeno>
        <OpstiAktOZigu>false</OpstiAktOZigu>
        <DokazPravaPrvenstva>false</DokazPravaPrvenstva>
        <DokazUplateTakse>false</DokazUplateTakse>
    </PriloziUzZahtev>
</ZahtevZaPriznanjeZiga>
