<?xml version="1.0" encoding="UTF-8"?>
<z:ZahtevZaPriznanjeZiga xmlns="ZAHTEV_ZA_PRIZNANJE_ZIGA"
 xmlns:xsi="http://www.w3.org/2001/XMLSchema-instance"
xmlns:z="ZAHTEV_ZA_PRIZNANJE_ZIGA"
 xsi:schemaLocation="ZAHTEV_ZA_PRIZNANJE_ZIGA file:/D:/Projects/web/XML-project/XML_WS_Trademark_backend/src/main/resources/xmls/ZahtevZaPriznjanjeZiga.xsd" id="0">
    <z:MetaData>
        <z:BrojPrijave>BrojPrijave0</z:BrojPrijave>
        <z:DatumPodnosenja>2006-05-04</z:DatumPodnosenja>
    </z:MetaData>
    <z:PodnosilacPrijave>
        <z:Ime>Ime0</z:Ime>
        <z:Adresa>
            <z:Ulica>Ulica0</z:Ulica>
            <z:BrojUlice>0</z:BrojUlice>
            <z:PostanskiBroj>0</z:PostanskiBroj>
            <z:MestoPrebivalista>MestoPrebivalista0</z:MestoPrebivalista>
            <z:DrzavaPrebivalista>DrzavaPrebivalista0</z:DrzavaPrebivalista>
        </z:Adresa>
        <z:KontaktInformacije>
            <z:Telefon>Telefon0</z:Telefon>
            <z:E-mail>E-mail0</z:E-mail>
            <z:Faks>Faks0</z:Faks>
        </z:KontaktInformacije>
    </z:PodnosilacPrijave>
    <z:PodnosilacPrijave>
        <z:Ime>Ime1</z:Ime>
        <z:Adresa>
            <z:Ulica>Ulica1</z:Ulica>
            <z:BrojUlice>0</z:BrojUlice>
            <z:PostanskiBroj>0</z:PostanskiBroj>
            <z:MestoPrebivalista>MestoPrebivalista1</z:MestoPrebivalista>
            <z:DrzavaPrebivalista>DrzavaPrebivalista1</z:DrzavaPrebivalista>
        </z:Adresa>
        <z:KontaktInformacije>
            <z:Telefon>Telefon1</z:Telefon>
            <z:E-mail>E-mail1</z:E-mail>
            <z:Faks>Faks1</z:Faks>
        </z:KontaktInformacije>
    </z:PodnosilacPrijave>
    <z:Punomocnik>
        <z:Ime>Ime2</z:Ime>
        <z:Adresa>
            <z:Ulica>Ulica2</z:Ulica>
            <z:BrojUlice>0</z:BrojUlice>
            <z:PostanskiBroj>0</z:PostanskiBroj>
            <z:MestoPrebivalista>MestoPrebivalista2</z:MestoPrebivalista>
            <z:DrzavaPrebivalista>DrzavaPrebivalista2</z:DrzavaPrebivalista>
        </z:Adresa>
        <z:KontaktInformacije>
            <z:Telefon>Telefon2</z:Telefon>
            <z:E-mail>E-mail2</z:E-mail>
            <z:Faks>Faks2</z:Faks>
        </z:KontaktInformacije>
    </z:Punomocnik>
    <z:ZajednickiPredstavnici>
        <z:Ime>Ime3</z:Ime>
        <z:Adresa>
            <z:Ulica>Ulica3</z:Ulica>
            <z:BrojUlice>0</z:BrojUlice>
            <z:PostanskiBroj>0</z:PostanskiBroj>
            <z:MestoPrebivalista>MestoPrebivalista3</z:MestoPrebivalista>
            <z:DrzavaPrebivalista>DrzavaPrebivalista3</z:DrzavaPrebivalista>
        </z:Adresa>
        <z:KontaktInformacije>
            <z:Telefon>Telefon3</z:Telefon>
            <z:E-mail>E-mail3</z:E-mail>
            <z:Faks>Faks3</z:Faks>
        </z:KontaktInformacije>
    </z:ZajednickiPredstavnici>
    <z:Zig>
        <z:TipZiga>TipZiga0</z:TipZiga>
        <z:TipZnaka>TipZnaka0</z:TipZnaka>
        <z:IzgledZnaka>ZGVmYXVsdA==</z:IzgledZnaka>
        <z:Boje>Boje0</z:Boje>
        <z:TransliteracijaZnaka>TransliteracijaZnaka0</z:TransliteracijaZnaka>
        <z:PrevodZnaka>PrevodZnaka0</z:PrevodZnaka>
        <z:OpisZnaka>OpisZnaka0</z:OpisZnaka>
    </z:Zig>
    <z:BrojeviKlasaRobeIliUsluga>
        <z:BrojKlaseRobeIliUsluge>0</z:BrojKlaseRobeIliUsluge>
        <z:BrojKlaseRobeIliUsluge>0</z:BrojKlaseRobeIliUsluge>
    </z:BrojeviKlasaRobeIliUsluga>
    <z:PravoPrvenstvaIOsnov>PravoPrvenstvaIOsnov0</z:PravoPrvenstvaIOsnov>
    <z:Taksa>
        <z:OsnovnaTaksa>0</z:OsnovnaTaksa>
        <z:TaksaZaBrojKlasa>0</z:TaksaZaBrojKlasa>
        <z:TaksaZaGrafickoResenje>0</z:TaksaZaGrafickoResenje>
        <z:Ukupno>0</z:Ukupno>
    </z:Taksa>
    <z:PriloziUzZahtev>
        <z:PrimerakZnaka>false</z:PrimerakZnaka>
        <z:SpisakRobeIUsluga>false</z:SpisakRobeIUsluga>
        <z:Punomocje>false</z:Punomocje>
        <z:PunomocjeRanijePrilozeno>false</z:PunomocjeRanijePrilozeno>
        <z:PunomocjeNaknadnoPrilozeno>false</z:PunomocjeNaknadnoPrilozeno>
        <z:OpstiAktOZigu>false</z:OpstiAktOZigu>
        <z:DokazPravaPrvenstva>false</z:DokazPravaPrvenstva>
        <z:DokazUplateTakse>false</z:DokazUplateTakse>
    </z:PriloziUzZahtev>
</z:ZahtevZaPriznanjeZiga>
